{
  "$schema": "https://json-schema.org/draft/2020-12/schema",
  "$id": "https://unpkg.com/scip-query/docs/schemas/outcome-event-record.schema.json",
  "title": "scip-query outcome event record v1",
  "description": "One immutable repository-owned finding transition stored under .scipquery/events/.",
  "type": "object",
  "required": ["kind", "schemaVersion", "eventIdentity", "writer", "ts", "check", "findingId", "event", "commit"],
  "properties": {
    "kind": { "const": "scip-query-outcome-event" },
    "schemaVersion": { "const": 1 },
    "eventIdentity": { "type": "string", "minLength": 1 },
    "writer": {
      "type": "object",
      "required": ["tool", "version"],
      "properties": {
        "tool": { "const": "scip-query" },
        "version": { "type": "string", "minLength": 1 }
      },
      "additionalProperties": true
    },
    "ts": { "type": "number" },
    "check": { "type": "string", "minLength": 1 },
    "findingId": { "type": "string", "minLength": 1 },
    "event": { "enum": ["caught", "resolved", "suppressed", "reopened"] },
    "commit": {
      "oneOf": [{ "type": "string" }, { "type": "null" }]
    },
    "comparisonBaseCommit": { "type": "string" },
    "verifiedAgainstCommit": { "type": "string" },
    "symbol": { "type": "string" },
    "gateRunId": { "type": "string", "minLength": 1, "maxLength": 256 },
    "observer": {
      "type": "object",
      "required": ["kind", "authority"],
      "properties": {
        "kind": { "enum": ["local-agent", "local-human", "protected-ci"] },
        "authority": { "enum": ["repository-writable", "protected-external"] },
        "source": { "type": "string", "minLength": 1, "maxLength": 256 }
      },
      "allOf": [
        {
          "if": { "properties": { "authority": { "const": "protected-external" } }, "required": ["authority"] },
          "then": { "properties": { "kind": { "const": "protected-ci" } } }
        }
      ],
      "additionalProperties": true
    },
    "observation": { "$ref": "./observation-receipt.schema.json" },
    "suppressionPolicyVersion": { "type": "integer", "minimum": 1 }
  },
  "allOf": [
    {
      "if": { "required": ["verifiedAgainstCommit"] },
      "then": { "properties": { "event": { "const": "resolved" } } }
    },
    {
      "if": { "required": ["suppressionPolicyVersion"] },
      "then": { "properties": { "event": { "const": "suppressed" } } }
    }
  ],
  "additionalProperties": true
}
