{
  "ts": 1785097843482,
  "check": "co-change-partner",
  "findingId": "SQ908776CFDF60",
  "event": "resolved",
  "commit": "4e542393534baf80a220b961c7cc06a7c7f7102a",
  "comparisonBaseCommit": "4e542393534baf80a220b961c7cc06a7c7f7102a",
  "kind": "scip-query-outcome-event",
  "schemaVersion": 1,
  "eventIdentity": "[\"co-change-partner\",\"SQ908776CFDF60\",\"resolved\",\"4e542393534baf80a220b961c7cc06a7c7f7102a\"]",
  "writer": {
    "tool": "scip-query",
    "version": "0.19.7"
  }
}
