{
  "ts": 1785485544602,
  "check": "echo",
  "findingId": "SQEEC0C2376D9B",
  "event": "caught",
  "commit": "2fe62ad68448a6801678def0cc68c77ddba8a918",
  "comparisonBaseCommit": "2fe62ad68448a6801678def0cc68c77ddba8a918",
  "symbol": "scip-typescript npm scip-query 0.20.0 src/domain/`completeness-obligation-admission.ts`/decodeCompletenessAdmissionRecord().",
  "gateRunId": "5d2a5921-cfbc-4649-b6e1-c6d03ada8680",
  "observer": {
    "kind": "local-agent",
    "authority": "repository-writable"
  },
  "observation": {
    "schemaVersion": 2,
    "observedAt": "2026-07-31T08:12:24.602Z",
    "facts": {
      "collaborationDomain": {
        "schemaVersion": 1,
        "canonicalizationVersion": 1,
        "hashAlgorithm": "sha256",
        "projection": {
          "name": "scip-query:collaboration-domain",
          "version": 1
        },
        "digest": "65fa7070a947c694f38de6708f2444d2bc2642785dcdb898d24a0401b41fb3c3"
      },
      "workspaceInstance": {
        "schemaVersion": 1,
        "canonicalizationVersion": 1,
        "hashAlgorithm": "sha256",
        "projection": {
          "name": "scip-query:workspace-instance",
          "version": 1
        },
        "digest": "f53b738aebdbca65df7f5d79a4bfc01cb854528c2a00705171682a625937c0c4"
      },
      "index": {
        "generation": {
          "schemaVersion": 1,
          "canonicalizationVersion": 1,
          "hashAlgorithm": "sha256",
          "projection": {
            "name": "scip-query:index-generation",
            "version": 1
          },
          "digest": "9b8d744c9277ee99509cf56107d4f1585588906c02c1350895ddfd406b65ce0b"
        },
        "source": "immutable"
      }
    },
    "observedSources": [
      {
        "kind": "index-generation",
        "identity": {
          "schemaVersion": 1,
          "canonicalizationVersion": 1,
          "hashAlgorithm": "sha256",
          "projection": {
            "name": "scip-query:index-generation",
            "version": 1
          },
          "digest": "9b8d744c9277ee99509cf56107d4f1585588906c02c1350895ddfd406b65ce0b"
        }
      },
      {
        "kind": "live-workspace",
        "identity": {
          "schemaVersion": 1,
          "canonicalizationVersion": 1,
          "hashAlgorithm": "sha256",
          "projection": {
            "name": "scip-query:workspace-instance",
            "version": 1
          },
          "digest": "f53b738aebdbca65df7f5d79a4bfc01cb854528c2a00705171682a625937c0c4"
        }
      }
    ],
    "stabilityProofs": [
      {
        "source": "index-generation",
        "kind": "immutable"
      },
      {
        "source": "live-workspace",
        "kind": "not-established"
      }
    ],
    "diagnostics": {
      "clean": false,
      "headCommit": "2fe62ad68448a6801678def0cc68c77ddba8a918",
      "treeOid": "e433051cfe2f73108081d18b4786cf10912d35f1"
    }
  },
  "kind": "scip-query-outcome-event",
  "schemaVersion": 1,
  "eventIdentity": "[\"echo\",\"SQEEC0C2376D9B\",\"caught\",\"2fe62ad68448a6801678def0cc68c77ddba8a918\"]",
  "writer": {
    "tool": "scip-query",
    "version": "0.20.0"
  }
}
