{
  "ts": 1785473905769,
  "check": "echo",
  "findingId": "SQ01B07D0B8836",
  "event": "resolved",
  "commit": "f9fef90c39996f526299ff66c83eea70e1b873fd",
  "comparisonBaseCommit": "f9fef90c39996f526299ff66c83eea70e1b873fd",
  "gateRunId": "fb6661d3-27c3-44ff-b2c1-d701c0e41258",
  "observer": {
    "kind": "local-agent",
    "authority": "repository-writable"
  },
  "observation": {
    "schemaVersion": 2,
    "observedAt": "2026-07-31T04:58:25.769Z",
    "facts": {
      "collaborationDomain": {
        "schemaVersion": 1,
        "canonicalizationVersion": 1,
        "hashAlgorithm": "sha256",
        "projection": {
          "name": "scip-query:collaboration-domain",
          "version": 1
        },
        "digest": "65fa7070a947c694f38de6708f2444d2bc2642785dcdb898d24a0401b41fb3c3"
      },
      "workspaceInstance": {
        "schemaVersion": 1,
        "canonicalizationVersion": 1,
        "hashAlgorithm": "sha256",
        "projection": {
          "name": "scip-query:workspace-instance",
          "version": 1
        },
        "digest": "f53b738aebdbca65df7f5d79a4bfc01cb854528c2a00705171682a625937c0c4"
      },
      "index": {
        "generation": {
          "schemaVersion": 1,
          "canonicalizationVersion": 1,
          "hashAlgorithm": "sha256",
          "projection": {
            "name": "scip-query:index-generation",
            "version": 1
          },
          "digest": "85f444ef759d931145349f78e916f50a09ba20ff02f42c752a49bba012d5a592"
        },
        "source": "immutable"
      }
    },
    "observedSources": [
      {
        "kind": "index-generation",
        "identity": {
          "schemaVersion": 1,
          "canonicalizationVersion": 1,
          "hashAlgorithm": "sha256",
          "projection": {
            "name": "scip-query:index-generation",
            "version": 1
          },
          "digest": "85f444ef759d931145349f78e916f50a09ba20ff02f42c752a49bba012d5a592"
        }
      },
      {
        "kind": "live-workspace",
        "identity": {
          "schemaVersion": 1,
          "canonicalizationVersion": 1,
          "hashAlgorithm": "sha256",
          "projection": {
            "name": "scip-query:workspace-instance",
            "version": 1
          },
          "digest": "f53b738aebdbca65df7f5d79a4bfc01cb854528c2a00705171682a625937c0c4"
        }
      }
    ],
    "stabilityProofs": [
      {
        "source": "index-generation",
        "kind": "immutable"
      },
      {
        "source": "live-workspace",
        "kind": "not-established"
      }
    ],
    "diagnostics": {
      "clean": false,
      "headCommit": "f9fef90c39996f526299ff66c83eea70e1b873fd",
      "treeOid": "a3eba5cc4c05313d13a97644e23f0295ae80dbfb"
    }
  },
  "kind": "scip-query-outcome-event",
  "schemaVersion": 1,
  "eventIdentity": "[\"echo\",\"SQ01B07D0B8836\",\"resolved\",\"f9fef90c39996f526299ff66c83eea70e1b873fd\"]",
  "writer": {
    "tool": "scip-query",
    "version": "0.20.0"
  }
}
