{
  "ts": 1785494940250,
  "check": "co-change-partner",
  "findingId": "SQ8FA34B0BBC01",
  "event": "reopened",
  "commit": "caa15f4563785d087636b0e0663182c4995465ff",
  "comparisonBaseCommit": "caa15f4563785d087636b0e0663182c4995465ff",
  "gateRunId": "319c14db-3ef5-4ebb-ba39-ee81637e15f3",
  "observer": {
    "kind": "local-agent",
    "authority": "repository-writable"
  },
  "observation": {
    "schemaVersion": 2,
    "observedAt": "2026-07-31T10:49:00.250Z",
    "facts": {
      "collaborationDomain": {
        "schemaVersion": 1,
        "canonicalizationVersion": 1,
        "hashAlgorithm": "sha256",
        "projection": {
          "name": "scip-query:collaboration-domain",
          "version": 1
        },
        "digest": "65fa7070a947c694f38de6708f2444d2bc2642785dcdb898d24a0401b41fb3c3"
      },
      "workspaceInstance": {
        "schemaVersion": 1,
        "canonicalizationVersion": 1,
        "hashAlgorithm": "sha256",
        "projection": {
          "name": "scip-query:workspace-instance",
          "version": 1
        },
        "digest": "f53b738aebdbca65df7f5d79a4bfc01cb854528c2a00705171682a625937c0c4"
      },
      "index": {
        "generation": {
          "schemaVersion": 1,
          "canonicalizationVersion": 1,
          "hashAlgorithm": "sha256",
          "projection": {
            "name": "scip-query:index-generation",
            "version": 1
          },
          "digest": "e75e135f12cb72e0883c0c235de9377b0f9a2db41f29aeaad3ebadd21139ac3b"
        },
        "source": "immutable"
      }
    },
    "observedSources": [
      {
        "kind": "index-generation",
        "identity": {
          "schemaVersion": 1,
          "canonicalizationVersion": 1,
          "hashAlgorithm": "sha256",
          "projection": {
            "name": "scip-query:index-generation",
            "version": 1
          },
          "digest": "e75e135f12cb72e0883c0c235de9377b0f9a2db41f29aeaad3ebadd21139ac3b"
        }
      },
      {
        "kind": "live-workspace",
        "identity": {
          "schemaVersion": 1,
          "canonicalizationVersion": 1,
          "hashAlgorithm": "sha256",
          "projection": {
            "name": "scip-query:workspace-instance",
            "version": 1
          },
          "digest": "f53b738aebdbca65df7f5d79a4bfc01cb854528c2a00705171682a625937c0c4"
        }
      }
    ],
    "stabilityProofs": [
      {
        "source": "index-generation",
        "kind": "immutable"
      },
      {
        "source": "live-workspace",
        "kind": "not-established"
      }
    ],
    "diagnostics": {
      "clean": false,
      "headCommit": "caa15f4563785d087636b0e0663182c4995465ff",
      "treeOid": "782ba376621deec6c6b37d6f68c4cab41b44f81a"
    }
  },
  "kind": "scip-query-outcome-event",
  "schemaVersion": 1,
  "eventIdentity": "[\"co-change-partner\",\"SQ8FA34B0BBC01\",\"reopened\",\"caa15f4563785d087636b0e0663182c4995465ff\"]",
  "writer": {
    "tool": "scip-query",
    "version": "0.20.0"
  }
}
