{
  "ts": 1785490317921,
  "check": "doc-reference",
  "findingId": "SQ6CF70BB93B0C",
  "event": "reopened",
  "commit": "77e36a087b00cafddb2e146590d860e9e53c433f",
  "comparisonBaseCommit": "77e36a087b00cafddb2e146590d860e9e53c433f",
  "gateRunId": "9d85182a-4c68-43e4-a525-0a3826e09cde",
  "observer": {
    "kind": "local-agent",
    "authority": "repository-writable"
  },
  "observation": {
    "schemaVersion": 2,
    "observedAt": "2026-07-31T09:31:57.921Z",
    "facts": {
      "collaborationDomain": {
        "schemaVersion": 1,
        "canonicalizationVersion": 1,
        "hashAlgorithm": "sha256",
        "projection": {
          "name": "scip-query:collaboration-domain",
          "version": 1
        },
        "digest": "65fa7070a947c694f38de6708f2444d2bc2642785dcdb898d24a0401b41fb3c3"
      },
      "workspaceInstance": {
        "schemaVersion": 1,
        "canonicalizationVersion": 1,
        "hashAlgorithm": "sha256",
        "projection": {
          "name": "scip-query:workspace-instance",
          "version": 1
        },
        "digest": "f53b738aebdbca65df7f5d79a4bfc01cb854528c2a00705171682a625937c0c4"
      },
      "index": {
        "generation": {
          "schemaVersion": 1,
          "canonicalizationVersion": 1,
          "hashAlgorithm": "sha256",
          "projection": {
            "name": "scip-query:index-generation",
            "version": 1
          },
          "digest": "0faf6fdae33eeb083e0526d548aa000311d29dead3039c79584955743bbd6d7e"
        },
        "source": "immutable"
      }
    },
    "observedSources": [
      {
        "kind": "index-generation",
        "identity": {
          "schemaVersion": 1,
          "canonicalizationVersion": 1,
          "hashAlgorithm": "sha256",
          "projection": {
            "name": "scip-query:index-generation",
            "version": 1
          },
          "digest": "0faf6fdae33eeb083e0526d548aa000311d29dead3039c79584955743bbd6d7e"
        }
      },
      {
        "kind": "live-workspace",
        "identity": {
          "schemaVersion": 1,
          "canonicalizationVersion": 1,
          "hashAlgorithm": "sha256",
          "projection": {
            "name": "scip-query:workspace-instance",
            "version": 1
          },
          "digest": "f53b738aebdbca65df7f5d79a4bfc01cb854528c2a00705171682a625937c0c4"
        }
      }
    ],
    "stabilityProofs": [
      {
        "source": "index-generation",
        "kind": "immutable"
      },
      {
        "source": "live-workspace",
        "kind": "not-established"
      }
    ],
    "diagnostics": {
      "clean": false,
      "headCommit": "77e36a087b00cafddb2e146590d860e9e53c433f",
      "treeOid": "8766afaf8064029bd9f0e8b6cfd57a24a55be80d"
    }
  },
  "kind": "scip-query-outcome-event",
  "schemaVersion": 1,
  "eventIdentity": "[\"doc-reference\",\"SQ6CF70BB93B0C\",\"reopened\",\"77e36a087b00cafddb2e146590d860e9e53c433f\"]",
  "writer": {
    "tool": "scip-query",
    "version": "0.20.0"
  }
}
