{
  "ts": 1785097637703,
  "check": "new-dead",
  "findingId": "SQ8EE4E18F0DF6",
  "event": "caught",
  "commit": "4e542393534baf80a220b961c7cc06a7c7f7102a",
  "comparisonBaseCommit": "4e542393534baf80a220b961c7cc06a7c7f7102a",
  "symbol": "scip-typescript npm scip-query 0.19.7 src/runtime/`output-pagination.ts`/OutputSnapshotWriter#",
  "kind": "scip-query-outcome-event",
  "schemaVersion": 1,
  "eventIdentity": "[\"new-dead\",\"SQ8EE4E18F0DF6\",\"caught\",\"4e542393534baf80a220b961c7cc06a7c7f7102a\"]",
  "writer": {
    "tool": "scip-query",
    "version": "0.19.7"
  }
}
