{
  "ts": 1785203488659,
  "check": "co-change-partner",
  "findingId": "SQ81C85F3058D3",
  "event": "caught",
  "commit": "32f0a8459e01ea38cc67ec3f081ccb9e0cf572df",
  "comparisonBaseCommit": "32f0a8459e01ea38cc67ec3f081ccb9e0cf572df",
  "kind": "scip-query-outcome-event",
  "schemaVersion": 1,
  "eventIdentity": "[\"co-change-partner\",\"SQ81C85F3058D3\",\"caught\",\"32f0a8459e01ea38cc67ec3f081ccb9e0cf572df\"]",
  "writer": {
    "tool": "scip-query",
    "version": "0.19.8"
  }
}
