{
  "ts": 1785472188016,
  "check": "co-change-partner",
  "findingId": "SQ8FA34B0BBC01",
  "event": "suppressed",
  "commit": "f86a967f24d9a1800da55fe31ae52d006dc3603d",
  "comparisonBaseCommit": "f86a967f24d9a1800da55fe31ae52d006dc3603d",
  "gateRunId": "29d588c6-3dda-438d-9d5c-70bab4e5ab39",
  "observer": {
    "kind": "local-agent",
    "authority": "repository-writable"
  },
  "observation": {
    "schemaVersion": 2,
    "observedAt": "2026-07-31T04:29:48.016Z",
    "facts": {
      "collaborationDomain": {
        "schemaVersion": 1,
        "canonicalizationVersion": 1,
        "hashAlgorithm": "sha256",
        "projection": {
          "name": "scip-query:collaboration-domain",
          "version": 1
        },
        "digest": "65fa7070a947c694f38de6708f2444d2bc2642785dcdb898d24a0401b41fb3c3"
      },
      "workspaceInstance": {
        "schemaVersion": 1,
        "canonicalizationVersion": 1,
        "hashAlgorithm": "sha256",
        "projection": {
          "name": "scip-query:workspace-instance",
          "version": 1
        },
        "digest": "f53b738aebdbca65df7f5d79a4bfc01cb854528c2a00705171682a625937c0c4"
      },
      "index": {
        "generation": {
          "schemaVersion": 1,
          "canonicalizationVersion": 1,
          "hashAlgorithm": "sha256",
          "projection": {
            "name": "scip-query:index-generation",
            "version": 1
          },
          "digest": "33312763e9fb091cb34333d3f24a165877ebe0b2dcf2e6ae5aa11876c0b380f1"
        },
        "source": "immutable"
      }
    },
    "observedSources": [
      {
        "kind": "index-generation",
        "identity": {
          "schemaVersion": 1,
          "canonicalizationVersion": 1,
          "hashAlgorithm": "sha256",
          "projection": {
            "name": "scip-query:index-generation",
            "version": 1
          },
          "digest": "33312763e9fb091cb34333d3f24a165877ebe0b2dcf2e6ae5aa11876c0b380f1"
        }
      },
      {
        "kind": "live-workspace",
        "identity": {
          "schemaVersion": 1,
          "canonicalizationVersion": 1,
          "hashAlgorithm": "sha256",
          "projection": {
            "name": "scip-query:workspace-instance",
            "version": 1
          },
          "digest": "f53b738aebdbca65df7f5d79a4bfc01cb854528c2a00705171682a625937c0c4"
        }
      }
    ],
    "stabilityProofs": [
      {
        "source": "index-generation",
        "kind": "immutable"
      },
      {
        "source": "live-workspace",
        "kind": "not-established"
      }
    ],
    "diagnostics": {
      "clean": false,
      "headCommit": "f86a967f24d9a1800da55fe31ae52d006dc3603d",
      "treeOid": "597c0b854fa06afb278866b224114c62d19aa933"
    }
  },
  "suppressionPolicyVersion": 1,
  "kind": "scip-query-outcome-event",
  "schemaVersion": 1,
  "eventIdentity": "[\"co-change-partner\",\"SQ8FA34B0BBC01\",\"suppressed\",\"f86a967f24d9a1800da55fe31ae52d006dc3603d\"]",
  "writer": {
    "tool": "scip-query",
    "version": "0.20.0"
  }
}
