{
  "ts": 1785640619610,
  "check": "co-change-partner",
  "findingId": "SQF3097FC5FF5C",
  "event": "resolved",
  "commit": "6680a89da80155190f108de2446e303b33961015",
  "comparisonBaseCommit": "6680a89da80155190f108de2446e303b33961015",
  "gateRunId": "930371a5-533c-4b76-a5c4-9ed1c1c20d5a",
  "observer": {
    "kind": "local-agent",
    "authority": "repository-writable"
  },
  "observation": {
    "schemaVersion": 2,
    "observedAt": "2026-08-02T03:16:59.610Z",
    "facts": {
      "collaborationDomain": {
        "schemaVersion": 1,
        "canonicalizationVersion": 1,
        "hashAlgorithm": "sha256",
        "projection": {
          "name": "scip-query:collaboration-domain",
          "version": 1
        },
        "digest": "65fa7070a947c694f38de6708f2444d2bc2642785dcdb898d24a0401b41fb3c3"
      },
      "workspaceInstance": {
        "schemaVersion": 1,
        "canonicalizationVersion": 1,
        "hashAlgorithm": "sha256",
        "projection": {
          "name": "scip-query:workspace-instance",
          "version": 1
        },
        "digest": "f53b738aebdbca65df7f5d79a4bfc01cb854528c2a00705171682a625937c0c4"
      },
      "index": {
        "generation": {
          "schemaVersion": 1,
          "canonicalizationVersion": 1,
          "hashAlgorithm": "sha256",
          "projection": {
            "name": "scip-query:index-generation",
            "version": 1
          },
          "digest": "a17afbbcd79e0cd84d47e29d1f11c97ab3410af7eb598c7b69328bb7ac3d4d31"
        },
        "source": "immutable"
      }
    },
    "observedSources": [
      {
        "kind": "index-generation",
        "identity": {
          "schemaVersion": 1,
          "canonicalizationVersion": 1,
          "hashAlgorithm": "sha256",
          "projection": {
            "name": "scip-query:index-generation",
            "version": 1
          },
          "digest": "a17afbbcd79e0cd84d47e29d1f11c97ab3410af7eb598c7b69328bb7ac3d4d31"
        }
      },
      {
        "kind": "live-workspace",
        "identity": {
          "schemaVersion": 1,
          "canonicalizationVersion": 1,
          "hashAlgorithm": "sha256",
          "projection": {
            "name": "scip-query:workspace-instance",
            "version": 1
          },
          "digest": "f53b738aebdbca65df7f5d79a4bfc01cb854528c2a00705171682a625937c0c4"
        }
      }
    ],
    "stabilityProofs": [
      {
        "source": "index-generation",
        "kind": "immutable"
      },
      {
        "source": "live-workspace",
        "kind": "not-established"
      }
    ],
    "diagnostics": {
      "clean": false,
      "headCommit": "6680a89da80155190f108de2446e303b33961015",
      "treeOid": "95fdab7525a427b5ebe9301ce6af3a60fd0eb97e"
    }
  },
  "kind": "scip-query-outcome-event",
  "schemaVersion": 1,
  "eventIdentity": "[\"co-change-partner\",\"SQF3097FC5FF5C\",\"resolved\",\"6680a89da80155190f108de2446e303b33961015\"]",
  "writer": {
    "tool": "scip-query",
    "version": "0.20.0"
  }
}
