{
  "ts": 1785131344674,
  "check": "doc-reference",
  "findingId": "SQ23C1BB6D5DF3",
  "event": "suppressed",
  "commit": "f61efd2ae9be7a9bb2138d75bafceb6bc028ff34",
  "comparisonBaseCommit": "f61efd2ae9be7a9bb2138d75bafceb6bc028ff34",
  "kind": "scip-query-outcome-event",
  "schemaVersion": 1,
  "eventIdentity": "[\"doc-reference\",\"SQ23C1BB6D5DF3\",\"suppressed\",\"f61efd2ae9be7a9bb2138d75bafceb6bc028ff34\"]",
  "writer": {
    "tool": "scip-query",
    "version": "0.19.8"
  }
}
