{
  "ts": 1785469447418,
  "check": "echo",
  "findingId": "SQ8161ADC87105",
  "event": "caught",
  "commit": "f4771df4355aa1424730c585d8f00550e7867f93",
  "comparisonBaseCommit": "f4771df4355aa1424730c585d8f00550e7867f93",
  "symbol": "scip-typescript npm scip-query 0.20.0 src/runtime/`claim-qualification.ts`/isNonNegativeSafeInteger().",
  "gateRunId": "120674b8-afdf-4c8b-b856-a4bc98ae28a1",
  "observer": {
    "kind": "local-agent",
    "authority": "repository-writable"
  },
  "observation": {
    "schemaVersion": 2,
    "observedAt": "2026-07-31T03:44:07.418Z",
    "facts": {
      "collaborationDomain": {
        "schemaVersion": 1,
        "canonicalizationVersion": 1,
        "hashAlgorithm": "sha256",
        "projection": {
          "name": "scip-query:collaboration-domain",
          "version": 1
        },
        "digest": "65fa7070a947c694f38de6708f2444d2bc2642785dcdb898d24a0401b41fb3c3"
      },
      "workspaceInstance": {
        "schemaVersion": 1,
        "canonicalizationVersion": 1,
        "hashAlgorithm": "sha256",
        "projection": {
          "name": "scip-query:workspace-instance",
          "version": 1
        },
        "digest": "f53b738aebdbca65df7f5d79a4bfc01cb854528c2a00705171682a625937c0c4"
      },
      "index": {
        "generation": {
          "schemaVersion": 1,
          "canonicalizationVersion": 1,
          "hashAlgorithm": "sha256",
          "projection": {
            "name": "scip-query:index-generation",
            "version": 1
          },
          "digest": "30481da6637d9a5a40518c15a703d4f889e71ea8ce4e6a9c65fa76fe7f6b9279"
        },
        "source": "immutable"
      }
    },
    "observedSources": [
      {
        "kind": "index-generation",
        "identity": {
          "schemaVersion": 1,
          "canonicalizationVersion": 1,
          "hashAlgorithm": "sha256",
          "projection": {
            "name": "scip-query:index-generation",
            "version": 1
          },
          "digest": "30481da6637d9a5a40518c15a703d4f889e71ea8ce4e6a9c65fa76fe7f6b9279"
        }
      },
      {
        "kind": "live-workspace",
        "identity": {
          "schemaVersion": 1,
          "canonicalizationVersion": 1,
          "hashAlgorithm": "sha256",
          "projection": {
            "name": "scip-query:workspace-instance",
            "version": 1
          },
          "digest": "f53b738aebdbca65df7f5d79a4bfc01cb854528c2a00705171682a625937c0c4"
        }
      }
    ],
    "stabilityProofs": [
      {
        "source": "index-generation",
        "kind": "immutable"
      },
      {
        "source": "live-workspace",
        "kind": "not-established"
      }
    ],
    "diagnostics": {
      "clean": false,
      "headCommit": "f4771df4355aa1424730c585d8f00550e7867f93",
      "treeOid": "dede0e51b4e914ec3834d0dbf8faa698b5d5f350"
    }
  },
  "kind": "scip-query-outcome-event",
  "schemaVersion": 1,
  "eventIdentity": "[\"echo\",\"SQ8161ADC87105\",\"caught\",\"f4771df4355aa1424730c585d8f00550e7867f93\"]",
  "writer": {
    "tool": "scip-query",
    "version": "0.20.0"
  }
}
