{
  "ts": 1785506446599,
  "check": "architecture",
  "findingId": "SQBC332F13AC4D",
  "event": "resolved",
  "commit": "7252bb0cf255be10d8dcef4d13d7e0a09e054c65",
  "comparisonBaseCommit": "7252bb0cf255be10d8dcef4d13d7e0a09e054c65",
  "gateRunId": "f5897d8b-1a72-40cf-91b2-1028316d1356",
  "observer": {
    "kind": "local-agent",
    "authority": "repository-writable"
  },
  "observation": {
    "schemaVersion": 2,
    "observedAt": "2026-07-31T14:00:46.599Z",
    "facts": {
      "collaborationDomain": {
        "schemaVersion": 1,
        "canonicalizationVersion": 1,
        "hashAlgorithm": "sha256",
        "projection": {
          "name": "scip-query:collaboration-domain",
          "version": 1
        },
        "digest": "65fa7070a947c694f38de6708f2444d2bc2642785dcdb898d24a0401b41fb3c3"
      },
      "workspaceInstance": {
        "schemaVersion": 1,
        "canonicalizationVersion": 1,
        "hashAlgorithm": "sha256",
        "projection": {
          "name": "scip-query:workspace-instance",
          "version": 1
        },
        "digest": "f53b738aebdbca65df7f5d79a4bfc01cb854528c2a00705171682a625937c0c4"
      },
      "index": {
        "generation": {
          "schemaVersion": 1,
          "canonicalizationVersion": 1,
          "hashAlgorithm": "sha256",
          "projection": {
            "name": "scip-query:index-generation",
            "version": 1
          },
          "digest": "1e12e5d84f4e047d2cef495caf5bb7e2078aa22f85225ac7bad2ce06de97554c"
        },
        "source": "immutable"
      }
    },
    "observedSources": [
      {
        "kind": "index-generation",
        "identity": {
          "schemaVersion": 1,
          "canonicalizationVersion": 1,
          "hashAlgorithm": "sha256",
          "projection": {
            "name": "scip-query:index-generation",
            "version": 1
          },
          "digest": "1e12e5d84f4e047d2cef495caf5bb7e2078aa22f85225ac7bad2ce06de97554c"
        }
      },
      {
        "kind": "live-workspace",
        "identity": {
          "schemaVersion": 1,
          "canonicalizationVersion": 1,
          "hashAlgorithm": "sha256",
          "projection": {
            "name": "scip-query:workspace-instance",
            "version": 1
          },
          "digest": "f53b738aebdbca65df7f5d79a4bfc01cb854528c2a00705171682a625937c0c4"
        }
      }
    ],
    "stabilityProofs": [
      {
        "source": "index-generation",
        "kind": "immutable"
      },
      {
        "source": "live-workspace",
        "kind": "not-established"
      }
    ],
    "diagnostics": {
      "clean": false,
      "headCommit": "7252bb0cf255be10d8dcef4d13d7e0a09e054c65",
      "treeOid": "b48e92a1ea40029764a146def20ed91a73332c2d"
    }
  },
  "kind": "scip-query-outcome-event",
  "schemaVersion": 1,
  "eventIdentity": "[\"architecture\",\"SQBC332F13AC4D\",\"resolved\",\"7252bb0cf255be10d8dcef4d13d7e0a09e054c65\"]",
  "writer": {
    "tool": "scip-query",
    "version": "0.20.0"
  }
}
