{
  "ts": 1785086517897,
  "check": "co-change-partner",
  "findingId": "SQED73CEBDE24D",
  "event": "reopened",
  "commit": "da1c11a74627ca8be19ab8eb4155437f4097009c",
  "comparisonBaseCommit": "da1c11a74627ca8be19ab8eb4155437f4097009c",
  "kind": "scip-query-outcome-event",
  "schemaVersion": 1,
  "eventIdentity": "[\"co-change-partner\",\"SQED73CEBDE24D\",\"reopened\",\"da1c11a74627ca8be19ab8eb4155437f4097009c\"]",
  "writer": {
    "tool": "scip-query",
    "version": "0.19.6"
  }
}
