{
  "ts": 1785477661611,
  "check": "echo",
  "findingId": "SQ54D619FDBA80",
  "event": "resolved",
  "commit": "bc4fad9683f43765f9471ceb1c4ab6db46696cdf",
  "comparisonBaseCommit": "bc4fad9683f43765f9471ceb1c4ab6db46696cdf",
  "gateRunId": "1ee013dc-a4ad-4c72-99c4-ab4957214c57",
  "observer": {
    "kind": "local-agent",
    "authority": "repository-writable"
  },
  "observation": {
    "schemaVersion": 2,
    "observedAt": "2026-07-31T06:01:01.611Z",
    "facts": {
      "collaborationDomain": {
        "schemaVersion": 1,
        "canonicalizationVersion": 1,
        "hashAlgorithm": "sha256",
        "projection": {
          "name": "scip-query:collaboration-domain",
          "version": 1
        },
        "digest": "65fa7070a947c694f38de6708f2444d2bc2642785dcdb898d24a0401b41fb3c3"
      },
      "workspaceInstance": {
        "schemaVersion": 1,
        "canonicalizationVersion": 1,
        "hashAlgorithm": "sha256",
        "projection": {
          "name": "scip-query:workspace-instance",
          "version": 1
        },
        "digest": "f53b738aebdbca65df7f5d79a4bfc01cb854528c2a00705171682a625937c0c4"
      },
      "index": {
        "generation": {
          "schemaVersion": 1,
          "canonicalizationVersion": 1,
          "hashAlgorithm": "sha256",
          "projection": {
            "name": "scip-query:index-generation",
            "version": 1
          },
          "digest": "71dd8e0820c5a0a30c1e719d00236bc37c69e14da0898ce8683ea7aa7a17602a"
        },
        "source": "immutable"
      }
    },
    "observedSources": [
      {
        "kind": "index-generation",
        "identity": {
          "schemaVersion": 1,
          "canonicalizationVersion": 1,
          "hashAlgorithm": "sha256",
          "projection": {
            "name": "scip-query:index-generation",
            "version": 1
          },
          "digest": "71dd8e0820c5a0a30c1e719d00236bc37c69e14da0898ce8683ea7aa7a17602a"
        }
      },
      {
        "kind": "live-workspace",
        "identity": {
          "schemaVersion": 1,
          "canonicalizationVersion": 1,
          "hashAlgorithm": "sha256",
          "projection": {
            "name": "scip-query:workspace-instance",
            "version": 1
          },
          "digest": "f53b738aebdbca65df7f5d79a4bfc01cb854528c2a00705171682a625937c0c4"
        }
      }
    ],
    "stabilityProofs": [
      {
        "source": "index-generation",
        "kind": "immutable"
      },
      {
        "source": "live-workspace",
        "kind": "not-established"
      }
    ],
    "diagnostics": {
      "clean": false,
      "headCommit": "bc4fad9683f43765f9471ceb1c4ab6db46696cdf",
      "treeOid": "8fc3685c19e44e5a6f9f6765a99c1df568921f3b"
    }
  },
  "kind": "scip-query-outcome-event",
  "schemaVersion": 1,
  "eventIdentity": "[\"echo\",\"SQ54D619FDBA80\",\"resolved\",\"bc4fad9683f43765f9471ceb1c4ab6db46696cdf\"]",
  "writer": {
    "tool": "scip-query",
    "version": "0.20.0"
  }
}
