{
  "ts": 1785534245519,
  "check": "co-change-partner",
  "findingId": "SQ7D8432797198",
  "event": "reopened",
  "commit": "6f9079bf72e25e810d001a2cc756ae6b358785bb",
  "comparisonBaseCommit": "6f9079bf72e25e810d001a2cc756ae6b358785bb",
  "gateRunId": "c0e9d3f1-3a7c-4fa6-91e2-a2d4d15d14d7",
  "observer": {
    "kind": "local-agent",
    "authority": "repository-writable"
  },
  "observation": {
    "schemaVersion": 2,
    "observedAt": "2026-07-31T21:44:05.519Z",
    "facts": {
      "collaborationDomain": {
        "schemaVersion": 1,
        "canonicalizationVersion": 1,
        "hashAlgorithm": "sha256",
        "projection": {
          "name": "scip-query:collaboration-domain",
          "version": 1
        },
        "digest": "65fa7070a947c694f38de6708f2444d2bc2642785dcdb898d24a0401b41fb3c3"
      },
      "workspaceInstance": {
        "schemaVersion": 1,
        "canonicalizationVersion": 1,
        "hashAlgorithm": "sha256",
        "projection": {
          "name": "scip-query:workspace-instance",
          "version": 1
        },
        "digest": "f53b738aebdbca65df7f5d79a4bfc01cb854528c2a00705171682a625937c0c4"
      },
      "index": {
        "generation": {
          "schemaVersion": 1,
          "canonicalizationVersion": 1,
          "hashAlgorithm": "sha256",
          "projection": {
            "name": "scip-query:index-generation",
            "version": 1
          },
          "digest": "7612ba36d72493baddf410f9c8c3e903f07a007b37b57e80eafda06d6209eb68"
        },
        "source": "immutable"
      }
    },
    "observedSources": [
      {
        "kind": "index-generation",
        "identity": {
          "schemaVersion": 1,
          "canonicalizationVersion": 1,
          "hashAlgorithm": "sha256",
          "projection": {
            "name": "scip-query:index-generation",
            "version": 1
          },
          "digest": "7612ba36d72493baddf410f9c8c3e903f07a007b37b57e80eafda06d6209eb68"
        }
      },
      {
        "kind": "live-workspace",
        "identity": {
          "schemaVersion": 1,
          "canonicalizationVersion": 1,
          "hashAlgorithm": "sha256",
          "projection": {
            "name": "scip-query:workspace-instance",
            "version": 1
          },
          "digest": "f53b738aebdbca65df7f5d79a4bfc01cb854528c2a00705171682a625937c0c4"
        }
      }
    ],
    "stabilityProofs": [
      {
        "source": "index-generation",
        "kind": "immutable"
      },
      {
        "source": "live-workspace",
        "kind": "not-established"
      }
    ],
    "diagnostics": {
      "clean": false,
      "headCommit": "6f9079bf72e25e810d001a2cc756ae6b358785bb",
      "treeOid": "eeaf7b8e7c9847b861f86a8954ec71679d7767a7"
    }
  },
  "kind": "scip-query-outcome-event",
  "schemaVersion": 1,
  "eventIdentity": "[\"co-change-partner\",\"SQ7D8432797198\",\"reopened\",\"6f9079bf72e25e810d001a2cc756ae6b358785bb\"]",
  "writer": {
    "tool": "scip-query",
    "version": "0.20.0"
  }
}
