{
  "ts": 1785496463832,
  "check": "doc-reference",
  "findingId": "SQBDDEBBE3E1F4",
  "event": "resolved",
  "commit": "2349c8be34451c533afaebae2f1c9afb5653c052",
  "comparisonBaseCommit": "2349c8be34451c533afaebae2f1c9afb5653c052",
  "verifiedAgainstCommit": "d3b1614767cc131d929997686d5f5ce8d4c8e03b",
  "gateRunId": "ded8f684-4694-44ba-af31-5dad1e5a5ddd",
  "observer": {
    "kind": "local-agent",
    "authority": "repository-writable"
  },
  "observation": {
    "schemaVersion": 2,
    "observedAt": "2026-07-31T11:14:23.832Z",
    "facts": {
      "collaborationDomain": {
        "schemaVersion": 1,
        "canonicalizationVersion": 1,
        "hashAlgorithm": "sha256",
        "projection": {
          "name": "scip-query:collaboration-domain",
          "version": 1
        },
        "digest": "65fa7070a947c694f38de6708f2444d2bc2642785dcdb898d24a0401b41fb3c3"
      },
      "workspaceInstance": {
        "schemaVersion": 1,
        "canonicalizationVersion": 1,
        "hashAlgorithm": "sha256",
        "projection": {
          "name": "scip-query:workspace-instance",
          "version": 1
        },
        "digest": "f53b738aebdbca65df7f5d79a4bfc01cb854528c2a00705171682a625937c0c4"
      },
      "index": {
        "generation": {
          "schemaVersion": 1,
          "canonicalizationVersion": 1,
          "hashAlgorithm": "sha256",
          "projection": {
            "name": "scip-query:index-generation",
            "version": 1
          },
          "digest": "887eb1e1dc26e1cfb7f035fd76d3235a192d889ae2c2778e3c3510a57f4e6007"
        },
        "source": "immutable"
      }
    },
    "observedSources": [
      {
        "kind": "index-generation",
        "identity": {
          "schemaVersion": 1,
          "canonicalizationVersion": 1,
          "hashAlgorithm": "sha256",
          "projection": {
            "name": "scip-query:index-generation",
            "version": 1
          },
          "digest": "887eb1e1dc26e1cfb7f035fd76d3235a192d889ae2c2778e3c3510a57f4e6007"
        }
      },
      {
        "kind": "live-workspace",
        "identity": {
          "schemaVersion": 1,
          "canonicalizationVersion": 1,
          "hashAlgorithm": "sha256",
          "projection": {
            "name": "scip-query:workspace-instance",
            "version": 1
          },
          "digest": "f53b738aebdbca65df7f5d79a4bfc01cb854528c2a00705171682a625937c0c4"
        }
      }
    ],
    "stabilityProofs": [
      {
        "source": "index-generation",
        "kind": "immutable"
      },
      {
        "source": "live-workspace",
        "kind": "not-established"
      }
    ],
    "diagnostics": {
      "clean": true,
      "headCommit": "2349c8be34451c533afaebae2f1c9afb5653c052",
      "treeOid": "3e2fb7f23551ffc37b33d5e523013c1b26bac6ff"
    }
  },
  "kind": "scip-query-outcome-event",
  "schemaVersion": 1,
  "eventIdentity": "[\"doc-reference\",\"SQBDDEBBE3E1F4\",\"resolved\",\"2349c8be34451c533afaebae2f1c9afb5653c052\"]",
  "writer": {
    "tool": "scip-query",
    "version": "0.20.0"
  }
}
