{
  "ts": 1785627559787,
  "check": "echo",
  "findingId": "SQ30EC0739C1E3",
  "event": "caught",
  "commit": "075e6d93bd8690a7433bceadc6582b1ad09daf8a",
  "comparisonBaseCommit": "075e6d93bd8690a7433bceadc6582b1ad09daf8a",
  "symbol": "scip-typescript npm scip-query 0.20.0 src/queries/internal/`callee-evidence.ts`/callableCalleeEvidence().",
  "gateRunId": "d5e58a37-30e0-4cf1-81dd-514f3997ba67",
  "observer": {
    "kind": "local-agent",
    "authority": "repository-writable"
  },
  "observation": {
    "schemaVersion": 2,
    "observedAt": "2026-08-01T23:39:19.787Z",
    "facts": {
      "collaborationDomain": {
        "schemaVersion": 1,
        "canonicalizationVersion": 1,
        "hashAlgorithm": "sha256",
        "projection": {
          "name": "scip-query:collaboration-domain",
          "version": 1
        },
        "digest": "65fa7070a947c694f38de6708f2444d2bc2642785dcdb898d24a0401b41fb3c3"
      },
      "workspaceInstance": {
        "schemaVersion": 1,
        "canonicalizationVersion": 1,
        "hashAlgorithm": "sha256",
        "projection": {
          "name": "scip-query:workspace-instance",
          "version": 1
        },
        "digest": "f53b738aebdbca65df7f5d79a4bfc01cb854528c2a00705171682a625937c0c4"
      },
      "index": {
        "generation": {
          "schemaVersion": 1,
          "canonicalizationVersion": 1,
          "hashAlgorithm": "sha256",
          "projection": {
            "name": "scip-query:index-generation",
            "version": 1
          },
          "digest": "881f0bdd7010e83ff06e5a4c03735616fb25c6ab68ed0fae50b143f6c4afafd7"
        },
        "source": "immutable"
      }
    },
    "observedSources": [
      {
        "kind": "index-generation",
        "identity": {
          "schemaVersion": 1,
          "canonicalizationVersion": 1,
          "hashAlgorithm": "sha256",
          "projection": {
            "name": "scip-query:index-generation",
            "version": 1
          },
          "digest": "881f0bdd7010e83ff06e5a4c03735616fb25c6ab68ed0fae50b143f6c4afafd7"
        }
      },
      {
        "kind": "live-workspace",
        "identity": {
          "schemaVersion": 1,
          "canonicalizationVersion": 1,
          "hashAlgorithm": "sha256",
          "projection": {
            "name": "scip-query:workspace-instance",
            "version": 1
          },
          "digest": "f53b738aebdbca65df7f5d79a4bfc01cb854528c2a00705171682a625937c0c4"
        }
      }
    ],
    "stabilityProofs": [
      {
        "source": "index-generation",
        "kind": "immutable"
      },
      {
        "source": "live-workspace",
        "kind": "not-established"
      }
    ],
    "diagnostics": {
      "clean": false,
      "headCommit": "075e6d93bd8690a7433bceadc6582b1ad09daf8a",
      "treeOid": "dafd1a959b789e44b6caa38bea85f157ae4b0491"
    }
  },
  "kind": "scip-query-outcome-event",
  "schemaVersion": 1,
  "eventIdentity": "[\"echo\",\"SQ30EC0739C1E3\",\"caught\",\"075e6d93bd8690a7433bceadc6582b1ad09daf8a\"]",
  "writer": {
    "tool": "scip-query",
    "version": "0.20.0"
  }
}
