{
  "ts": 1785491326875,
  "check": "co-change-partner",
  "findingId": "SQB26525BAEF6A",
  "event": "suppressed",
  "commit": "cc06a95b7a662413f74b5d62df89abfff446ce73",
  "comparisonBaseCommit": "cc06a95b7a662413f74b5d62df89abfff446ce73",
  "gateRunId": "91bb8471-173a-4083-8f65-859dba8da309",
  "observer": {
    "kind": "local-agent",
    "authority": "repository-writable"
  },
  "observation": {
    "schemaVersion": 2,
    "observedAt": "2026-07-31T09:48:46.875Z",
    "facts": {
      "collaborationDomain": {
        "schemaVersion": 1,
        "canonicalizationVersion": 1,
        "hashAlgorithm": "sha256",
        "projection": {
          "name": "scip-query:collaboration-domain",
          "version": 1
        },
        "digest": "65fa7070a947c694f38de6708f2444d2bc2642785dcdb898d24a0401b41fb3c3"
      },
      "workspaceInstance": {
        "schemaVersion": 1,
        "canonicalizationVersion": 1,
        "hashAlgorithm": "sha256",
        "projection": {
          "name": "scip-query:workspace-instance",
          "version": 1
        },
        "digest": "f53b738aebdbca65df7f5d79a4bfc01cb854528c2a00705171682a625937c0c4"
      },
      "index": {
        "generation": {
          "schemaVersion": 1,
          "canonicalizationVersion": 1,
          "hashAlgorithm": "sha256",
          "projection": {
            "name": "scip-query:index-generation",
            "version": 1
          },
          "digest": "3cb247371680dc5da6c4d478c2292fb7e4c28c6bffa996dc4032f19eab41b3de"
        },
        "source": "immutable"
      }
    },
    "observedSources": [
      {
        "kind": "index-generation",
        "identity": {
          "schemaVersion": 1,
          "canonicalizationVersion": 1,
          "hashAlgorithm": "sha256",
          "projection": {
            "name": "scip-query:index-generation",
            "version": 1
          },
          "digest": "3cb247371680dc5da6c4d478c2292fb7e4c28c6bffa996dc4032f19eab41b3de"
        }
      },
      {
        "kind": "live-workspace",
        "identity": {
          "schemaVersion": 1,
          "canonicalizationVersion": 1,
          "hashAlgorithm": "sha256",
          "projection": {
            "name": "scip-query:workspace-instance",
            "version": 1
          },
          "digest": "f53b738aebdbca65df7f5d79a4bfc01cb854528c2a00705171682a625937c0c4"
        }
      }
    ],
    "stabilityProofs": [
      {
        "source": "index-generation",
        "kind": "immutable"
      },
      {
        "source": "live-workspace",
        "kind": "not-established"
      }
    ],
    "diagnostics": {
      "clean": false,
      "headCommit": "cc06a95b7a662413f74b5d62df89abfff446ce73",
      "treeOid": "38d6f25d89bd2e7e9f3b014fb77ac0cd82732291"
    }
  },
  "suppressionPolicyVersion": 1,
  "kind": "scip-query-outcome-event",
  "schemaVersion": 1,
  "eventIdentity": "[\"co-change-partner\",\"SQB26525BAEF6A\",\"suppressed\",\"cc06a95b7a662413f74b5d62df89abfff446ce73\"]",
  "writer": {
    "tool": "scip-query",
    "version": "0.20.0"
  }
}
