{
  "ts": 1785130933709,
  "check": "architecture",
  "findingId": "SQF3BB25994045",
  "event": "resolved",
  "commit": "f61efd2ae9be7a9bb2138d75bafceb6bc028ff34",
  "comparisonBaseCommit": "f61efd2ae9be7a9bb2138d75bafceb6bc028ff34",
  "kind": "scip-query-outcome-event",
  "schemaVersion": 1,
  "eventIdentity": "[\"architecture\",\"SQF3BB25994045\",\"resolved\",\"f61efd2ae9be7a9bb2138d75bafceb6bc028ff34\"]",
  "writer": {
    "tool": "scip-query",
    "version": "0.19.8"
  }
}
